{
  "schema_version": 1,
  "tool_version": "source-adoption-input-v1",
  "adoption_id": "stacks-introduction-072k-g001-20261022",
  "origin_commit": "0cb216b48e4be743fb38483f482643b033550eda",
  "source_commit": "a04446e57ec1fbc252a871afcec7752fb2807b14",
  "task_id": "stacks-introduction-remaining-20261022",
  "created_at": "2026-10-22T07:25:50.584767Z",
  "runtime": {
    "model_lane": "openai-gpt-6.1-sol",
    "model": {
      "record_id": "openai:gpt-6.1-sol:declared",
      "provider": "OpenAI",
      "requested_id": "gpt-6.1-sol",
      "resolved_id": "gpt-6.1-sol",
      "snapshot": null,
      "identity_confidence": "declared"
    },
    "harness": {
      "id": "codex",
      "version": "0.163.0-alpha.11.1",
      "adapter_version": "stacks-harness-v1"
    },
    "reasoning_effort": "high",
    "turn_id": "01a16259-ab08-7db3-95bc-cf36f0b665bf",
    "replayable": false
  },
  "policies": [
    {
      "path": "upstream.lock",
      "hash": "sha256:34bcb6f597c576cd063eaf08016dbce0d65b7a58164183c1b2042f16d7fa5be4"
    },
    {
      "path": "config/workflow.yml",
      "hash": "sha256:721223d58e73ebee6b140350b23dc157e9e6ee54e915564fa64b35828f7a00a0"
    },
    {
      "path": "config/macro-policy.yml",
      "hash": "sha256:455621d041a1babe6efbfbddd272ee246b616d7e0a86616160a479407692d4dc"
    },
    {
      "path": "config/glossary.yml",
      "hash": "sha256:9fd4f9a43fb330f595aed1440d106bcda0773852ecab418d7dfe1f68d68aba6c"
    },
    {
      "path": "config/source-terms.json",
      "hash": "sha256:4223840c7e8259e889e2c5b45adc3c848f322c2e3704df70ccf94534491943fe"
    },
    {
      "path": "config/style-guide.md",
      "hash": "sha256:c6866028ee4340a9536f63f7a8ff72f6ebcf767d8149ecb86e689b8437b6c030"
    },
    {
      "path": "config/models.yml",
      "hash": "sha256:1f960426fde2e8edfe9001092d1127833706294ff0b5d3c24522675193abcda5"
    },
    {
      "path": "config/harnesses.yml",
      "hash": "sha256:3faaf84c8f9e48fa59559f26f306198fe1ed738e5374911e52e9c6f2b1ad34fb"
    },
    {
      "path": "prompts/translator-v2.md",
      "hash": "sha256:a5f8f3f3ac98c45d2d81bb7410c4c7baf87fbbe721eab33347b68e17714af6d9"
    },
    {
      "path": "schema/unit.schema.json",
      "hash": "sha256:dbd4f4549279686932a12aa6dfdf3150d90f91caf154b4ff142965d4df9c9fe3"
    },
    {
      "path": "schema/candidate.schema.json",
      "hash": "sha256:6e5ce42a17abf06faed80e37a93ad9b680568b1dfcae4efc476bfa4c04870761"
    },
    {
      "path": "schema/source-adoption.schema.json",
      "hash": "sha256:f2b20afb265d8f9778f6130d3c75d7bcd61c9cdad97e897dc37c4a94a164c660"
    },
    {
      "path": "schema/source-adoption-input.schema.json",
      "hash": "sha256:7b1313f35335b087184e33deaba05c59feacf1fdc58d067e346d4d0c051ea3fb"
    },
    {
      "path": "schema/math-text-regions.schema.json",
      "hash": "sha256:6356772ca7ffca48590404610a63cf02ae41984116130bc6b6013384f8d538d1"
    },
    {
      "path": "schema/math-text-components.schema.json",
      "hash": "sha256:1556ca6e05cbbb89f8abaae061e0fc04d7c33dacd3583f644b2ea18d5d2e236b"
    },
    {
      "path": "schema/run-manifest.schema.json",
      "hash": "sha256:a6574d9077a2e278bca208750e35e353ef4128cc8ac5a32483ed86c7ca3d0d23"
    },
    {
      "path": "schema/translator-output.schema.json",
      "hash": "sha256:3311f0f6dff5dd350f2991ec69cd5d0cc34f8faecab4f9d2dfcc01d71ad9c34d"
    },
    {
      "path": "schema/task-scope.schema.json",
      "hash": "sha256:c7b81a9ee956f4f47ae60af660024d6deefcb9069f15ed0447cb71832fe355db"
    }
  ],
  "contexts": [
    {
      "context_id": "neighbor:inventory:stacks-introduction:072J:paragraph/0002",
      "value": {
        "kind": "locked-English-neighbor",
        "location": {
          "file": "stacks-introduction.tex",
          "byte_start": 1443,
          "byte_end": 2547,
          "line_start": 55,
          "line_end": 78,
          "fragment_hash": "sha256:f328b8985defdaedc6c6bcaa0e38753f4489320481dff95f1632338be22c648f"
        },
        "source_commit": "a04446e57ec1fbc252a871afcec7752fb2807b14",
        "source_unit": {
          "schema_version": 1,
          "unit_id": "inventory:stacks-introduction:072J:paragraph/0002",
          "parent_tag": "072J",
          "chapter": "stacks-introduction",
          "node_kind": "paragraph",
          "risk_level": "R1",
          "source_commit": "a04446e57ec1fbc252a871afcec7752fb2807b14",
          "source_text": "Given elliptic curves <MATH_0001> and <MATH_0002> a\n<TEXTITOPEN_0001>morphism of elliptic curves over <MATH_0003><TEXTITCLOSE_0001>\nis a morphism <MATH_0004> such that the diagram\n<MATH_0005>\nis commutative and the inner square is cartesian, in other words the\nmorphism <MATH_0006> induces an isomorphism <MATH_0007>.\nWe are going to define the stack of elliptic curves <MATH_0008>.\nIn the rest of the Stacks project we work out the method introduced in\nDeligne and Mumford's paper <REF_0001> which consists in presenting\n<MATH_0009> as a category endowed with a functor\n<MATH_0010>\nThis means you work with fibred categories over the categories of schemes,\ntopologies, stacks fibred in groupoids, coverings, etc, etc.\nIn this chapter we throw all of that out of the window and\nwe think about it a bit differently -- probably closer to how the initiators\nof the theory started thinking about it themselves.",
          "source_status": "CURRENT",
          "placeholders": {
            "MATH_0001": "$(E, f, 0)/S$",
            "MATH_0002": "$(E', f', 0')/S'$",
            "TEXTITOPEN_0001": "{\\it ",
            "MATH_0003": "$a : S \\to S'$",
            "TEXTITCLOSE_0001": "}",
            "MATH_0004": "$\\alpha : E \\to E'$",
            "MATH_0005": "$$\n\\xymatrix{\nE \\ar[rr]_\\alpha \\ar[d]^f & & E' \\ar[d]_{f'}  \\\\\nS \\ar@/^5ex/[u]^0 \\ar[rr]^a & & S' \\ar@/_5ex/[u]_{0'}\n}\n$$",
            "MATH_0006": "$\\alpha$",
            "MATH_0007": "$E \\to S \\times_{S'} E'$",
            "MATH_0008": "$\\mathcal{M}_{1, 1}$",
            "REF_0001": "\\cite{DM}",
            "MATH_0009": "$\\mathcal{M}_{1, 1}$",
            "MATH_0010": "$$\np : \\mathcal{M}_{1, 1} \\longrightarrow \\Sch, \\quad\n(E, f, 0)/S \\longmapsto S\n$$"
          },
          "render": {
            "prefix": "",
            "suffix": ""
          },
          "source_text_hash": "sha256:a74522712d7a57c8dc1880143e77c118450ace90853c9d532c474fc10778cda8",
          "source_structure_hash": "sha256:7766a3ae612be4da44621ffa8609d0a063ae34b6b296c650bd414d1acf18d45e",
          "source_math_hash": "sha256:5b312d9ccdf62c47aeac2114fcccb4bea1f15397a057e2b219e8772cb94c9fc0"
        },
        "owner_tag": "072J",
        "parent_tag": "072J"
      },
      "hash": "sha256:0b1533cf83f6c061c8a85fae587a8ce72c2c99020aea98b1dab88664fdf70f37"
    },
    {
      "context_id": "neighbor:inventory:stacks-introduction:072K:paragraph/0001",
      "value": {
        "kind": "locked-English-neighbor",
        "location": {
          "file": "stacks-introduction.tex",
          "byte_start": 2636,
          "byte_end": 2679,
          "line_start": 84,
          "line_end": 85,
          "fragment_hash": "sha256:e53eafa3c0db88d88d335cf81539e5eea2f2fcca9d469c9ab258b7199e25e7e0"
        },
        "source_commit": "a04446e57ec1fbc252a871afcec7752fb2807b14",
        "source_unit": {
          "schema_version": 1,
          "unit_id": "inventory:stacks-introduction:072K:paragraph/0001",
          "parent_tag": "072K",
          "chapter": "stacks-introduction",
          "node_kind": "paragraph",
          "risk_level": "R1",
          "source_commit": "a04446e57ec1fbc252a871afcec7752fb2807b14",
          "source_text": "<STRUCT_0001>\nHere is what we are going to do:\n",
          "source_status": "CURRENT",
          "placeholders": {
            "STRUCT_0001": "\\noindent"
          },
          "render": {
            "prefix": "",
            "suffix": ""
          },
          "source_text_hash": "sha256:477c39ad0f27e4a2dedc5606ef4438d2d08cada6dd633151ea204117a712b1dd",
          "source_structure_hash": "sha256:586210d0cf9ed4621462f9e5ec0ebaf0c3465f0d9473832ae86369ac1f3b2476",
          "source_math_hash": "sha256:44136fa355b3678a1146ad16f7e8649e94fb4fc21fe77e8310c060f61caaff8a"
        },
        "owner_tag": "072K",
        "parent_tag": "072K"
      },
      "hash": "sha256:560ad8e3560306aefd500ee1e34426c14110f355e44d3bb19afc5a2a18dada24"
    },
    {
      "context_id": "neighbor:inventory:stacks-introduction:072K:section_title/0001",
      "value": {
        "kind": "locked-English-neighbor",
        "location": {
          "file": "stacks-introduction.tex",
          "byte_start": 2550,
          "byte_end": 2634,
          "line_start": 81,
          "line_end": 82,
          "fragment_hash": "sha256:42947db732a93ba875e9ef348d4111aa6e06cb817ce117651a54958f0a697879"
        },
        "source_commit": "a04446e57ec1fbc252a871afcec7752fb2807b14",
        "source_unit": {
          "schema_version": 1,
          "unit_id": "inventory:stacks-introduction:072K:section_title/0001",
          "parent_tag": "072K",
          "chapter": "stacks-introduction",
          "node_kind": "section_title",
          "risk_level": "R1",
          "source_commit": "a04446e57ec1fbc252a871afcec7752fb2807b14",
          "source_text": "<TEXTOPEN_0001>The moduli stack of elliptic curves<TEXTCLOSE_0001>\n<LOCKED_0001>",
          "source_status": "CURRENT",
          "placeholders": {
            "TEXTOPEN_0001": "\\section{",
            "TEXTCLOSE_0001": "}",
            "LOCKED_0001": "\\label{section-moduli-elliptic-curves}"
          },
          "render": {
            "prefix": "",
            "suffix": ""
          },
          "source_text_hash": "sha256:d80ae491527348a2d602b9e815b087f5c83781b94796bbffafc9da8d0a44e055",
          "source_structure_hash": "sha256:b3c4cd8d3cd8882c162ecc7128d22fab69fa9cf1d5a6286af4c9c380d483e6be",